text,adv_text,minimal_k
"Auto Retailer CarMax Trims Outlook  DETROIT (Reuters) - Auto retailer CarMax Inc. &lt;A HREF=""http://www.investor.reuters.com/FullQuote.aspx?ticker=KMX.N target=/stocks/quickinfo/fullquote""&gt;KMX.N&lt;/A&gt; on  Tuesday cut its second-quarter earnings forecast due to  slower-than-expected used-car sales, sparking a 3.7 percent  drop in its shares.","Auto Retailer CarMax Trims Outlook  DETROIT (Reuters) - Auto retailer CarMax Inc. &lt;A HREF=""http://www.investor.reuters.com/FullQuote.aspx?ticker=KMX.N target=/stocks/quickinfo/fullquote""&gt;KMX.N&lt;/une&gt; on  Friday chopped its second-quarter earnings forecast due to  slower-than-expected used-car sales, unleashing a 3.7 percent  drop onto its shares.",5.0
"Google Puts Library Collections Online including out of print volumes -- soon will become part of the vast Google database. Harvard, Stanford, the University of Michigan, the University of Oxford, and the New ","Google Puts Auditorium Collections Online including out of print volumes -- soon will become part of the vast Google database. Harvard, Stanford, the University to Michigan, the University to Oxford, y nova New ",5.0
Ryder Cup reunion at Valderrama Europe #39;s Ryder Cup team is having a reunion this week at Valderrama. All 12 members of the team which beat the United States at Oakland Hills last month are playing in the European tour #39;s season-ending Volvo Masters.,Ryder Cup reunion at Valderrama Europe #39;s Ryder Cup team is having a reunion this weeks at Valderrama. All 12 members of the team which beat the United States at Oakland Hills last month are toying onto de European trips #39;s season-ending Volvo Masters.,5.0
"Sony debuts PSP game console in Japan Sony said it will make half the console #39;s components, compared with 40 percent for the PlayStation 2, to set itself apart from competitors.","Sony debuts PSP game console in Japan Sony said it will make average du console #39;s ingredients, compared with 40 percent for the PlayStation 2, to set himself moreover from competitors.",5.0
"Mussina, Matsui Lead Yankees Past Red Sox (Reuters) Reuters - Mike Mussina retired the first 19\batters he faced and Hideki Matsui drove in five runs as the","Mussina, Matsui Lead Yankees Past Red Yanks (Reuters) Reuters - Mike Mussina retired the first 19\batters he faced and Hideki Matsui pushed across five manages as nova",5.0
News: Anti-virus outfit defends job for VXer Czech company Zoner Software has explained why it employed a prominent former virus writer to develop anti-virus software on its behalf.,News: Anti-virus suit defends job for VXer Czech company Zoner Software has elucidate why it employed a prominent yesteryear virus writer for develop anti-virus software on its name.,5.0
"Slowing house market quiets lending Mortgage lending has declined for the second consecutive month as a result of the slowing housing market, says the Council of Mortgage Lenders.","Slowing house market quiets willing Mortgage lending has plummeted for the second consecutive month as a result of du slowing housing market, affirms the Council to Mortgage Lenders.",5.0
"NASA rovers will explore Mars for six more months PASADENA, CALIF. - The twin Martian robotic rovers Spirit and Opportunity will explore the Red Planet for another six months, NASA said Tuesday.","NASA rovers will explore Mars for six more months PASADENA, CALIF. - The twofold Martian robotic rovers Spirit and Opportunity will explore the Red Earth toward another six months, NASA avowed Monday.",5.0
"US, Europe trade officials to discuss Airbus-Boeing dispute US &lt;b&gt;...&lt;/b&gt; The dispute over subsidies to Airbus and Boeing are expected to be on the agenda as the new commissioner of the European Trade Union, Peter Mandelson, and his counterpart from the United States, Robert Zoeller, started discussions Monday.","US, Europe trade officials to discuss Airbus-Boeing dispute US &lt;b&gt;...&lt;/b&gt; The dispute over subsidize to Boeing and Boeing be projected to be on the agenda as the new commissioner of the European Trade Union, Peter Mandelson, and his counterpart from the United States, Robert Zoeller, undertook discussions Monday.",5.0
Second hat in ring for faster Wi-Fi standard A second consortium puts in a bid for the faster 802.11n spec. But don't expect a battle over formats.,Secs hat in ring for faster Wi-Fi standard A seconds consortium puts in a bid for the faster 802.11n spec. But don't wait a tussle over formatted.,5.0
"Anwar may return by month #39;s end Malaysia #39;s former deputy leader Anwar Ibrahim reportedly plans to return home on October 31 after nearly two months abroad, but will avoid any strenuous political activity throughout the Muslim fasting month that ends next month.","Anwar maggio returned by month #39;s end Malaysia #39;s former deputy leader Anwar Ibrahim reportedly plans to return home on October 31 after nearly two months abroad, but will evade any strenuous political activity throughout the Muslim fasting month that terminates impending month.",5.0
"Dell recalls laptop power supplies OCTOBER 08, 2004 (IDG NEWS SERVICE) - Dell Inc. is recalling about 990,000 electrical adapters manufactured in China by Taipei, Taiwan-based Delta Electronics Inc.","Dell reminds laptop power supplies OCTOBER 08, 2004 (IDG NEWS SERVICE) - Del Inc. is reminded about 990,000 electrical adapters fabrication in China para Taipei, Taiwan-based Delta Electronics Inc.",5.0
"Bush Aides Laugh Off 'Wired Debate' Rumor (AP) AP - Campaign aides to President Bush on Saturday laughed off rampant Internet speculation about whether the president was wired to get help from advisers during his first debate with Sen. John Kerry. ""It's not true. It's ridiculous,"" Bush campaign spokesman Scott Stanzel said.","Bush Aides Kidding Disconnecting 'Wired Debate' Rumor (AP) AP - Campaign aides to President Bush on Saturday laughed off rampant Internet speculation about whether the president was wired to get help from advisers during his first debate with Sen. John Kerry. ""It's nos veritable. It's nonsense,"" Bush campaign spokesman Scott Stanzel said.",5.0
"Europe, Islam #39;s New Front Line: The Netherlands Description: In the Netherlands, the recent murder of controversial filmmaker Theo Van Gogh by a Muslim extremist has revealed a climate of mistrust and fear between Muslims and traditional Dutch society.","Europa, Islam #39;s New Front Line: The Netherlands Description: In the Antilles, the newest murder of controversial filmmaker Theo Van Gogh by a Muslim extremist has revealed a climatic of censure and fear between Muslims and traditional Dutch society.",5.0
"Lehman said to be next US Ryder captain Former British Open champion Tom Lehman will be the next US Ryder Cup captain, it was reported Tuesday. The Palm Beach Post said Lehman will lead the team at the 2006 matches in Kildare, Ireland.","Lehman said to be next US Ryder captain Former British Open champion Tom Lehman will be the next US Ryder Cup captain, it was reported Mardi. The Palm Swimming Post affirmed Lehman will lead the team onto the 2006 equalize in Kildare, Ireland.",5.0
"Baghdad hit by car bomb blasts At least three people have been killed in a suspected suicide car bomb blast outside Baghdad #39;s main hospital, Iraqi police and medics say.","Baghdad beaten by vehicles bombs blasts During least three citizens have been killed in a suspected suicide car bomb blast outside Baghdad #39;s main hospital, Iraqi police and medics say.",5.0
"Verheugen - Gul Joint Press Conference ANKARA - Guenter Verheugen, the European Union (EU) Commissioner, Enlargement, said that the decision that would be taken about Turkey in December could not be delayed, stressing that the Progress Report (of the EU Commission) on Turkey that would be made ","Verheugen - Gul Joint Press Conference ANKARA - Guenter Verheugen, the European Union (EU) Commissioner, Enlargement, said that the decision that would be taken about Turkey in December could nope be postponement, affirming that nova Progress Rapport (of the EU Commission) on Turkey that would be made ",5.0
"Microsoft Opens Office for Governments Microsoft (Quote, Chart) has extended its Government Security Program (GSP) by offering government customers access to the source code of Microsoft Office 2003.","Microsoft Begins Office for Governments Microsoft (Quote, Card) has extended its Goverment Security Program (GSP) by offering government customers access for the source code to Microsoft Office 2003.",5.0
"Nikkei Up 1.6 Percent by on Wall St Jump (Reuters) Reuters - Japan's Nikkei average rose 1.62 percent\by midsession on Thursday as investors, cheered by a jump in\U.S. stocks, bought a broad range of shares including those\they had avoided recently due partly to doubts about U.S.\demand.","Nikkei Up 1.6 Percent by regarding Wall St Skips (Reuters) Reuters - Japan's Nikkei average rose 1.62 percent\by midsession on Thursday as investors, cheered by a jump in\U.S. stocks, procuring a broad range of shares including those\they had dodged recently due partly to doubts about U.S.\requests.",5.0
"Eyeing Iran Reactors, Israel Seeks U.S. Bunker Bombs (Reuters) Reuters - The United States plans to sell\Israel  #36;319 million worth of air-launched bombs, including 500\""bunker busters"" able to penetrate Iran's underground nuclear\facilities, Israeli security sources said on Tuesday.","Eyeing Iran Reactors, Israel Strives U.S. Bunker Explodes (Reuters) Reuters - The United States plans to sale\Israel  #36;319 million worth of air-launched bombs, including 500\""bunker busters"" able to penetrate Iran's underground nuclear\facilities, Israeli security fuentes declared on Tuesday.",5.0
"Saks announces store closings BIRMINGHAM, Ala. They #39;re closing eight Saks Fifth Avenue stores and three Off Fifth outlet stores. Saks Incorporated says shutting down weaker stores will allow the company to focus on its more  quot;productive quot; locations and further strengthen its brand.","Neiman announces store shutdown BIRMINGHAM, Ala. They #39;re closing eight Saks Fifth Avenue stores and three Off Fifth outlet stores. Saks Embed affirms shutting down weaker warehouse will allow the company to focus on its more  quot;productive quot; locations and further strengthen its brand.",5.0
Beasley Leads PSV to Another Shutout Win (AP) AP - U.S. midfielder DaMarcus Beasley scored a goal Sunday to help lead PSV Eindhoven past Vitesse Arnhem 2-0 in the Dutch league  #151; the 10th straight shutout for unbeaten PSV.,Beasley Leeds PSV of Another Shutout Gaining (AP) AP - U.S. midfielder DaMarcus Beasley scored a goal Sunday to help lead PSV Eindhoven past Vitesse Arnhem 2-0 in the Dutch league  #151; to 10th sequential shutout for unbeaten PSV.,5.0
"M. Hampton, P ATLANTA (Ticker) -- Now that they have ended their three-game losing streak, the Atlanta Braves can focus on winning another division title.","M. Hampton, phosphorus ATLANTA (Ticker) -- Presently that they have finalized their three-game losing streak, the Atlanta Braves can accent regarding winning another division title.",5.0
"MicroStrategy Turnover Draws Analyst Scrutiny MicroStrategy Inc. said yesterday that president and chief financial officer Eric F. Brown had resigned and that founder Michael J. Saylor would again hold the company's top three jobs, prompting some analysts to raise concerns about the company's stock.","MicroStrategy Turnover Drawn Analyst Checkups MicroStrategy Inc. said yesterday that president and chief financial officer Eric F. Brown had resigned and that founder Michael J. Saylor would again hold the company's top three jobs, obliging some analysts to augmentation concerns around the company's stock.",5.0
"Iran Delivers  #39;Strategic Missile #39; To Armed Forces 25 September 2004 -- The Iranian defense minister announced today that the country has successfully test-fired a strategic, long-range missile and delivered the weapon to its armed forces.","Iran Delivers  #39;Strategic Rockets #39; To Armed Forces 25 September 2004 -- The Iranian defense ministry announced today that the country has successfully test-fired a strategic, long-range missile and delivered du weaponry to its cocked forces.",5.0
House Leadership Blocks Vote on Intelligence Bill A core of highly conservative Republicans aligned with the Pentagon moved to block a vote on a bill that would have enacted the recommendations of the 9/11 panel.,Abode Leadership Blocks Vote on Mind Bill A nucleus of highly conservative Republicans aligned with the Pentagon moved to block una vote on a bill that would have formulating the recommendations of the 9/11 panel.,5.0
"Few steps towards peace peak Leh, Nov. 8: Three days, nearly 40 delegations and hundreds of kilometres later, home minister Shivraj Patil believes he has walked a few steps forward on the long and winding road that could lead to peace in Kashmir.","Shortly strides towards peace peak Leh, Nov. 8: Three days, nearly 40 delegations and hundreds of kilometres subsequently, home minister Shivraj Patil believes he has walked una few steps forward on the long and winding road that could lead to tranquil in Kashmir.",5.0
"Election Commission Stops Vote Count As Opposition Protests Ukraine #39;s Central Election Commission has suspended vote counting from the 31 October presidential election. The opposition says that #39;s because a complete count would reveal that its leader, Viktor Yushchenko ","Wahl Commission Stops Vote Count As Opposition Demonstrators Ukraine #39;s Central Election Commission has suspended vote counting from the 31 October presidential election. The opposition proclaims that #39;s already a complete count would discloses that its leader, Viktor Yushchenko ",5.0
"Scientists May Use Drugs to Stop Addiction By MALCOLM RITTER    NEW YORK (AP) -- Can Prozac help you kick cocaine? Can Ritalin? How about a blood pressure pill or medicine for muscle spasms? If you're an alcoholic, could you get help staying sober by taking an anti-nausea drug used by cancer patients?    Scientists are exploring those questions right now. In fact, in the field of addiction medicine, one of the hottest sources of new drugs is .....","Scientists May Use Drugs to Stop Addiction By MALCOLM RITTER    NEW YORK (AP) -- Can Prozac help you kick cocaine? Can Ritalin? How about a blood pressure pill or medicine for muscle spasms? If you're an alcoholic, could you get help staying sober by taking an anti-nausea drug used by cancer patients?    Scientists are exploring those questions right now. Onto done, in the field of addiction medicine, one of the heartiest originated of new narcotic is .....",5.0
"Kerry, Bush battle for crucial military vote (AFP) AFP - Republican President George W. Bush and Democratic challenger John Kerry are battling feverishly for the support of soldiers and veterans, but Bush seems to have gained the upper hand as Kerry's military past comes under attack.","Kerry, Bush struggling for crucial military vote (AFP) AFP - Republican President George W. Bush and Democratic challenger John Kerry are battling feverishly for the support of soldiers and veterans, but Bush seems to have gained de upper hand as Kerry's military bygones happens for attack.",5.0
"Singer: Minaya returns home NEW YORK -- Omar Minaya stood behind a small lectern in a danky room in the bowels of Shea Stadium, and allowed his life to flash before his eyes.","Singer: Minaya restitution home NEW YORK -- Omar Minaya totalled behind a small lectern in a danky room in the bowels of Shea Stadium, and authorizes his perpetuity to blink before his eyes.",5.0
"VSNL buys out Tyco unit for \$130 mn MUMBAI, NOVEMBER 1: India Inc is stepping up acquisitions abroad. In its latest shopping abroad, Tata group firm Videsh Sanchar Nigam Ltd (VSNL) has signed an agreement to buy Bermuda-based Tyco Global Network ","VSNL buys out Tyco unit for \$130 mn MUMBAI, NOVEMBER 1: India Inc is stepping up acquisitions abroad. Onto its newer shopping externally, Tata group firm Videsh Sanchar Nigam Ltd (VSNL) has subscribed an agreement to procured Bermuda-based Tyco Global Network ",5.0
Aussies and Reubens grab Chelsfield SHOPPING centres giant Westfield has cut a deal with fellow Australian developer Multiplex and billionaires Simon and David Reuben to carve up property group Chelsfield in a purchase worth 2.,Aussies and Reubens grab Chelsfield SHOPPING centres jumbo Westfield has severing a deal with fellow Australian developer Multiplex and billionaires Simon and David Reuben to carve up immovable group Chelsfield in una shopping worth 2.,5.0
"As China tries to avoid a hard landing, it #39;s difficult to get &lt;b&gt;...&lt;/b&gt; For one thing, even if Chinese growth slowed in the third quarter, it won #39;t indicate whether Asia #39;s second-biggest economy is avoiding a hard landing.","As China tries to avoid a hard landing, it #39;s difficult to get &lt;b&gt;...&lt;/b&gt; Toward eden thing, even if Chinese growth slowed in the third quarter, it won #39;tons indicates lf Asia #39;s second-biggest economy is avoiding a hard landing.",5.0
"Intel introduces new mobile chip Intel Corp., the world #39;s largest chip maker, on Tuesday introduced a powerful mobile chip running at 3.33 GHz for notebook computers.","Intel introduces new cellphone chip Intel Corp., the world #39;s largest chip maker, on Tuesday introduced a powerful notebook microprocessor running at 3.33 GHz toward notebook equipment.",5.0
Google #39;s auction wrapping up NEW YORK (CBS.MW) -- Google #39;s long-awaited kickoff as the largest Internet IPO of all time is likely to take place as early as Wednesday after the controversial Dutch auction process wraps up after the bell. ,Google #39;s auction wrapper upwards NEW YORK (CBS.MW) -- Google #39;s long-awaited kickoff as the largest Internet IPO of all time is likely to take place as early as Wednesday after the controversial Dutch auction process envelopes up subsequently the cloche. ,5.0
"Generosity warms chilly morning Daily Telegram Staff Writer. ADRIAN -- In the midst of planning holiday get-togethers, shopping trips and Christmas lists, remember to take time for those not as fortunate.","Generosity warms chilly morning Daily Telegram Staff Writer. ADRIAN -- Across the medium of planning holiday get-togethers, shopping trips and Christmas lists, remember to taking time per those nie as fortunate.",5.0
"Arafat #39;s medical records may be released A spokesperson for the French Defence Ministry has said the medical records of the late Yasser Arafat can be released to certain parties, such as his family.","Arafat #39;s medical records may be released A spokesman for the French Defence Ministry has asserted the physician records of the iate Yasser Arafat can be liberating to certain parties, such as his family.",5.0
Norway and US share Nobel prize Finn Kydland and Edward Prescott have won the Nobel prize for economics for their work in showing how business cycles affect international trade.,Norway and US share Prize prize Finn Kydland and Edward Prescott have earn the Nobel prize for economics in their cooperation in illustrating how business cycles affect international trade.,5.0
"Ispat, LNM, ISG merge to form world's largest steelmaker (AFP) AFP - Dutch-Indian steel group Ispat International announced that it had agreed to merge with Dutch LNM Holdings and US International Steel Group to form the world's largest steelmaker, which would be known as Mittal Steel.","Ispat, LNM, ISG combine to form world's wider steelmaker (AFP) AFP - Dutch-Indian steel group Ispat International announced that it had embraced to merge with Dutch LNM Holdings and US International Steel Clustered to form the world's grandest steelmaker, which would be known as Mittal Steel.",5.0
"Sudan warns West Cairo - The speaker of the Sudanese parliament on Sunday warned the West against intervening in his country, saying it would open the  quot;gates of hell quot;.","Sudan alerted West Cairo - The speaker of the Khartoum parliament on Sunday alert the Westerner against intervening in his country, saying it would open the  quot;gates of whorehouse quot;.",5.0
"Blair faces wrath of Labour Party faithful over Iraq BRIGHTON : Prime Minister Tony Blair was set to face the anger of rank and file members of his Labour Party over the Iraq war, as party officials tried to head off a motion calling for British troops to quit the country.","Blair faces wrath of Labour Party faithful over Iraq BRIGHTON : Prime Minister Tony Blair was set to face de anger of rank and file members of his Labour Party over the Iraq war, as party officials endeavour to leiter seaward a motion calling for British troops to discontinue the country.",5.0
"Chargers Edge Broncos, 20-17 (AP) AP - The Chargers  #151; yes, the Chargers  #151; took firm control of the AFC West by hanging on to beat the Denver Broncos 20-17 in a wild one on Sunday. LaDainian Tomlinson ran for two touchdowns and San Diego's defense saved the day by intercepting Jake Plummer four times, including in the end zone in the closing minutes.","Chargers Edge Broncos, 20-17 (AP) AP - The Chargers  #151; yes, the Chargers  #151; took firm control of the AFC West by hanging on to beat the Denver Broncos 20-17 in a wild one on Sunday. LaDainian Tomlinson escaped to two fumbles and San Diego's defense saved nova dias by intercepting Jake Plummer four times, including in the end zone in the closing minutes.",5.0
"Cairn puts Rajasthan crude output at 5mn tons Cairn Energy, the UK-based oil  amp; gas major said on Tuesday that it plans to produce up to 5mn tons of crude oil from its recent discoveries in Rajasthan by the end of 2007.","Cairn begs Rajasthan garish output per 5mn tons Cairn Energy, the UK-based oil  amp; gas major said on Tuesday that it plans to produce up to 5mn tons of crude oil from its recent discoveries in Rajasthan by the discontinue to 2007.",5.0
"Blair Makes Partial Iraq Apology to Win Back Party  BRIGHTON, England (Reuters) - Tony Blair offered his Labour  party on Tuesday a partial apology for waging war in Iraq,  striving to pull angry supporters behind him ahead of an  election next year.","Blair Makes Partial Bagdad Apologies to Triumphs Back Party  BRIGHTON, England (Reuters) - Toni Blair offered his Labour  party on Tuesday a partial apologize for waging war in Iraq,  striving to pull angry supporters behind him ahead of an  election next year.",5.0
Science Geek Gifts for All Banish underwear from your gift-giving list this year! Your smarty-pants friends and relatives aren't as hard to buy for as you might think. The web is full of brain-gratifying gift ideas. By Kristen Philipkoski.,Science Geek Gifts for All Forbid underwear from your gift-giving list this year! Your smarty-pants friends and relatives aren't as hard to buy for as you might think. The web exists full of brain-gratifying donation perceptions. Para Kristen Philipkoski.,5.0
Focus on deadly Africa diseases The UN's Global Fund meets African leaders in Tanzania for talks on fighting the world's deadliest diseases.,Focus on deadly Continent diseases The UN's Global Fund meets African leaders in Tanzania on chitchat on combat nova world's deadliest diseases.,5.0
"Programs: for Stealth Lovers, 'Thief' Is a Steal (Reuters) Reuters - One of the joys of the games\in the ""Thief"" series is the ability to sneak up on opponents,\quietly take them out with a good knock on the noggin, and then\dump their body in the shadows so you can resume your hunt for\loot.","Programs: for Stealth Lovers, 'Thief' Is a Pried (Reuters) Reuters - Uno of the joys of the games\for the ""Thief"" series exists the ability to sneak up on opponents,\quietly take them out with a good knock on the noggin, and thereby\dump their body in the shadows so you can resume your hunt for\loot.",5.0
"Grinstein: Delta Board OKs Stock Plan; 6,000 To Be Axed Dimmer switch on those holiday lights. The board of Delta Air Lines (nyse: DAL - news - people ) gave its OK to use an exception to the New York Stock Exchange #39;s investor approval policy.","Grinstein: Triangle Board OKs Stock Plan; 6,000 To Be Axed Dimmer switch on those holiday lights. The board of Delta Air Lines (nyse: DAL - news - people ) yielded its ALLRIGHT to use an waiving to the New York Stock Exchange #39;s investor approbation policy.",5.0
"It's a happy homecoming He said he did away with his inner fan in 1993, when he was signed by the San Francisco Giants. The team he adored, the St. Louis Cardinals, was still in his heart but almost out of his mind. That was tough for a kid who grew up in the St. Louis suburb of Maryland Heights, wanting ...","It's a happy restitution He said he does outside with his inner breather in 1993, when he was signed by the San Francisco Giants. The team he adored, the St. Louis Cardinals, was still in his heart but almost out of his mind. That was harsh for a kid who grew up in the St. Louis suburb of Maryland Heights, wanting ...",5.0
President Declares War on Terror Laksamana.Net - President Susilo Bambang Yudhoyono says terrorism is the enemy of all religions so they must wage war against the violent scourge.,Presiding Declares War on Terror Laksamana.Net - President Susilo Bambang Yudhoyono contends terrorism is the enemy of all creeds thereby they must remuneration war against the violent scourge.,5.0
Cambodia Reports New Bird Flu Outbreak Cambodia says it has found a new outbreak of bird flu in a province near Phnom Penh. Cambodia #39;s agriculture ministry says all birds at the farm where the outbreak was found will be slaughtered.,Cambodia Reports New Bird Flu Outbreak Cambodia says it has found a new outbreak of bird flu in a province near Phnom Penh. Cambodian #39;s agriculture ministry affirms whole birds at the farm where the outbreak was found volition be gunned.,5.0
