text,adv_text,minimal_k
American Airlines Raises Domestic Fares American Airlines says it is raising domestic fares by \$5 one-way and \$10 per round trip to cover the high cost of jet fuel. American said Friday that the increase took effect immediately for most domestic flights as well as those to Canada.,American Airlines Raises Domestic Fares American Airlines says it is raising domestic fares by \$5 one-way and \$10 per round trip to cover the high cost of jet fuel. Americans avowed Thursday that nova increase took effect forthwith for most domestic flights as well as those to Canada.,5.0
"Update 2: Gilead Sciences Stocks Rise Six Percent Biotechnology stocks were trading down marginally Thursday afternoon with the large exception of Gilead Sciences Inc., whose shares were boosted by good results for an HIV treatment.","Retrofitted 2: Gilead Scientifically Stock Rise Six Cent Biotechnology stocks were trading down marginally Thursday afternoon with the large exception of Gilead Sciences Inc., whose shares were boosted by good results into an HIV treatment.",5.0
More Than 160 Taken Hostage in Iraq (AP) AP - Insurgents in Iraq have kidnapped more than 160 foreigners. Those held are:,More Than 160 Taken Hostage in Iraq (AP) AP - Insurgents in Iraq have hijackers more than 160 extraterrestrial. Ones obligated constitute:,5.0
" #39;IAEA may have to  quot;beg quot; Iran for more cooperation #39; LONDON, Sep 17 (IranMania) - Iran #39;s powerful former president Akbar Hashemi Rafsanjani warned Friday that the International Atomic Energy Agencymay have to  quot;beg quot; for Tehran #39;s cooperation if it bows to US pressure."," #39;IAEA may have to  quot;beg quot; Iran towards more cooperation #39; LONDON, Sep 17 (IranMania) - Iran #39;s powerful former president Akbar Hashemi Rafsanjani warned Friday that the International Atomic Energy Agencymay have to  quot;vagrancy quot; for Tehran #39;s cooperated if it arches to AMERICAN pressure.",5.0
"Kazaa accused of creating global music piracy system The producers of a popular file sharing program have created the biggest system of Internet music piracy ever seen, the Federal Court in Sydney has been told.","Kazaa defendant of creating universally music piracy system The producers of a popular file sharing program ai created the akbar system of Internet music pirates ever seen, the Federal Court in Sydney has been told.",5.0
"Sweet! Anheuser-Busch #39;s new brew Brewer Anheuser-Busch said Monday it would introduce a caffeinated, sweet-flavored beer for twentysomething club goers to compete with the flavored rums and vodkas gaining ground on the dance floor.","Sugary! Anheuser-Busch #39;s newest brew Brewer Anheuser-Busch said Monday it would introduce a caffeinated, sweet-flavored budweiser for twentysomething club goers to compete with the flavored rums and vodkas gain ground for the dance floor.",5.0
"Boy becomes a Manning ANOTHER LOSS meant another sleepless night for New York Giants coach Tom Coughlin. It was 3 am Monday morning, less than 12 hours after his team had lost to the Arizona Cardinals ","Boy becomes une Manning ANOTHER LOSS meant another malevolence evening for New York Giants coach Tom Coughlin. It was 3 suis Tonight morning, less than 12 hours after his team had lost to the Arizona Cardinals ",5.0
"Movie industry sues file swappers Taking a page from the music industry #39;s playbook, the movie industry filed lawsuits in St. Louis and elsewhere Tuesday as part of a national campaign to crack down on piracy online.","Movie industry sues archived swappers Taking a page from the music industry #39;s playbook, the movie industry filed proceedings in St. Louis and elsewhere Tuesday as part of a national campaign to fissures down onto piracy onscreen.",5.0
PNA lauds diplomatic reconciliation with Kuwait A Palestinian National Authority(PNA) senior official said Monday that the PNA welcomed a diplomatic reconciliation with Kuwait in a sign that the relations between the two sides were improving.,PNA lauds diplomatic reconciliation with Kuwait A Palestinian National Authority(PNA) senior official said Monday that du PNA greet a diplomat reconciliation with Kuwait in a sign that the relations between the two sides constituted refinements.,5.0
"AMD dual-core Opterons gain SSE 3 support AMD #39;s dual-core AMD64 chips will provide instructions compatible with Intel #39;s SSE 3 technology, the chip maker announced at the Microprocessor Forum yesterday.","AMD dual-core Opterons obtained SSE 3 supporting AMD #39;s dual-core AMD64 chips will provide directive compatible with Intel #39;s SSE 3 technology, nova chip maker announced at the Microprocessor Forum mondays.",5.0
Labor leaders seek to remedy shortcoming of locals SAN FRANCISCO (CBS.MW) - Supermarket workers in northern California are preparing for a possible strike against Safeway - just as their sister union local in Los Angeles did for nearly five months ended in March.,Labor leaders seek to repair deficiencies to locals SAN FRANCISCO (CBS.MW) - Supermarket workers in northern California are preparing for a workable strike against Safeway - just as their sister union local in Los Angeles did for nearly five months ended at March.,5.0
Bomb blast shatters Baghdad cafe A powerful explosion kills six and injures at least 20 at a cafe in Baghdad popular with Iraqi police officers.,Blaster blast shatters Baghdad cafe una vigorous explosion kills six and traumas per least 20 at a cafe in Baghdad popular with Iraqi police officers.,5.0
"Government confirms Stanchart wins Bank Permata sale JAKARTA (Dow Jones): A consortium led by Standard Chartered PLC has won the bidding for a 51 percent stake in PT Bank Permata, Indonesia #39;s seventh-largest lender, Minister of Finance Boediono said on Friday.","Goverment affirm Stanchart won Bank Permata sale JAKARTA (Dow Jones): A consortium led by Norms Accredited PLC has won the bidding for a 51 percent stake in PT Bank Permata, Indonesia #39;s seventh-largest lender, Minister of Finance Boediono said on Friday.",5.0
"EU, U.S. Meet to Discuss Trade (Reuters) Reuters - Europe's trade chief Peter Mandelson\meets his U.S. counterpart Robert Zoellick for the first time\on Monday amid signs of a truce in the dispute over government\aid for rivals Boeing and Airbus.","EU, U.S. Meet to Discuss Trade (Reuters) Reuters - Europe's trade chief Peter Mandelson\satisfies his U.S. counterpart Robert Zoellick for the first time\on Monday amid signs of a truce in the dispute finished governments\aid during rivals Boeing and Boeing.",5.0
"Beat Hackers and Learn to Spy at Italy Tech Fair  MILAN (Reuters) - Fingerprint sensors, gadgets to pry open  doors and transmitters to spy on unsuspecting targets were  among the wizardry on show at the opening of Italy's biggest  technology fair on Thursday.","Vanquished Hackers y Learns to Spy onto Italy Tech Fair  MILAN (Reuters) - Fingerprint sensors, gadgets to pry open  doors and transmitters to spy on unsuspecting targets were  among the wizardry on show at the opening of Italy's grander  technology fair on Thursday.",5.0
"Loss-making FEER goes monthly HONG KONG - Dow Jones  amp; Company, which publishes vital business and financial news and information, announced that the Far Eastern Economic Review will change its format from a news weekly to a monthly magazine of issues and ideas, largely written by ","Loss-making FEER disappears monthly HONG KONG - Dow Jones  amp; Company, which publishes vital business and financial news and information, announced that the Far Eastern Economic Review will change its format from a news weekly to a monthly magazine to issues and brainchild, essentially writes by ",5.0
Indonesian Court Opens Bashir Terror Trial  JAKARTA (Reuters) - Indonesian Islamic cleric Abu Bakar  Bashir went on trial on Thursday accused of leading an al  Qaeda-linked militant network and of planning or inciting  others to carry out attacks in the world's most populous Muslim  nation.,Indonesian Hof Opens Bashir Terrorist Trial  JAKARTA (Reuters) - Indonesian Islamic cleric Abu Bakar  Bashir went onto trial onto Wednesday accused of leading an al  Qaeda-linked militant network and of planning or inciting  others to carry out attacks in the world's most populous Muslim  nation.,5.0
"Allen-Rutan partner aims high POWAY, Calif. -- The man whose firm built the engine expected to power SpaceShipOne into suborbital space today plans to build his own craft and compete with his more celebrated partners, Paul Allen and Burt Rutan, for the extraterrestrial turf.","Allen-Rutan partner intent alto POWAY, Calif. -- The man whose firm built the engine expected to power SpaceShipOne into suborbital space today plans to build his own craft and rivalry with his more celebrated partners, Paul Allen and Burt Rutan, onto to extraterrestrial turf.",5.0
"1st Profit Forecast for Reynolds American  CHICAGO (Reuters) - Reynolds American Inc. &lt;A HREF=""http://www.investor.reuters.com/FullQuote.aspx?ticker=RAI.N target=/stocks/quickinfo/fullquote""&gt;RAI.N&lt;/A&gt;, parent  of the No. 2 U.S. cigarette company, on Wednesday forecast 2004  profit of \$5.75 to \$6.05 a share, its first forecast since the  company was formed at the end of July.","1st Profit Predicted for Reynolds American  CHICAGO (Reuters) - Reynolds American Inc. &lt;A HREF=""http://www.investor.reuters.com/FullQuote.aspx?ticker=RAI.N target=/stocks/quickinfo/fullquote""&gt;RAI.N&lt;/une&gt;, parent  of the No. 2 U.S. cigarette company, on Wednesday forecast 2004  profit of \$5.75 to \$6.05 a share, its first expected since nova  enterprise was formed at the end of July.",5.0
"No. 1 Illinois Tops Oregon, 83-66 (AP) AP - Illinois apparently is going to spend a little longer at No. 1 this time.","No. 1 Illinois Tops Oregon, 83-66 (AP) AP - Illinois apparently is going to expenditures a kiddo longer for No. 1 cette moment.",5.0
Grassley Defends Whistle-Blower Food and Drug Administration whistle-blower David J. Graham believes he will soon be transferred or fired in retaliation for telling a congressional hearing that the agency is falling short ,Grassley Defends Whistle-Blower Meal and Drug Administration whistle-blower David J. Graham deems he will soon be transferred nor fired in retaliation for telling a congressional hearing that the agency is declines succinctly ,5.0
"The Lessons of Najaf In the face-off at the shrine, U.S.\ and Iraqi leaders vowed to crush\ al-Sadr's rebellion. But they may have stoked the insurgency even\ more","The Lessons of Najaf In the face-off at the shrine, U.S.\ and Iraqi leaders vowed to crush\ al-Sadr's rebellion. But they maggio have stimulated nova insurgency yet\ plus",5.0
Death demand for self-confessed plotter SOUTH African alleged mercenary leader Nick du Toit admitted yesterday that he had recruited personnel and taken charge of logistics for a coup attempt in Equatorial Guinea.,Mort requests for self-confessed plotter SOUTH African alleged mercenary leader Nick du Toit accepted yesterday that he had recruited personnel and taken expense of logistics for a coup endeavor in Equatorial Guinea.,5.0
"Arafat supporters hold overnight vigil outside hospital in Paris &lt;b&gt;...&lt;/b&gt; CLAMART, France, Nov 4 (AFP) - Several dozen people on Thursday gathered outside a military hospital near Paris where Palestinian leader Yasser Arafat was being kept alive by artificial life support systems.","Arafat supporters hold overnight vigil outside hospital in Paris &lt;b&gt;...&lt;/b&gt; CLAMART, France, Nov 4 (AFP) - Innumerable dozen humans sobre Tonight garnered outside a military hospital near Paris where Palestinian leader Yasser Arafat was being kept alive by artificial life support systems.",5.0
"Higher Costs, Less Care In the past four years, Americans have spent a growing portion of their paychecks on health care and for the most part gotten less for their money, according to government figures and several independent studies.","Best Costs, Lower Care In the past four years, Americans have spent a growing portion of their paychecks on health care and for the most part gotten less for their money, conforming the government figures and sundry independent studies.",5.0
"Skating to Europe According to the International Ice Hockey Federation, 276 N.H.L. players have signed with European teams. Could hockey be headed for a new world order?","Skating to Europe According to the International Ice Hockey Federation, 276 N.H.L. players have signed with European teams. Did hockey worden governed per a new world decrees?",5.0
"Campaigning Bush cites ""horror"" of Russian crisis (AFP) AFP - US President George W. Bush told voters in the crucial state of Ohio that Russia's bloody hostage crisis was  quot;a grim reminder quot; of the stakes in his global war on terrorism.","Campaigning Bush refers ""horror"" di Russian crisis (AFP) AFP - AMERICAN President George W. Bush told voters in the crucial state of Ohio that Russia's bloody hostage crisis was  quot;a grim reminder quot; of nova pickets in his global war on terrorism.",5.0
"Cold but resolute in Kiev  KIEV -- The weather plunges below freezing each night and the bitter winds swirl through the snow-lined streets, but the protesters filling the avenues and squares of Ukraine's capital have shown no sign of relenting.","Iced but resolute during Kiev  KIEV -- The weather plunges below freezing each night and the bitter winds swirl through the snow-lined streets, nevertheless the protesters filling the avenues and squares of Ukraine's capital have exemplified no sign del relenting.",5.0
HENRY SHOWS HE IS STILL KING Thierry Henry answered his critics in style as he combined with Robert Pires to haul Arsenal out of their slump. Henrys recent form had been called into question by Match of the Day pundit Alan Hansen only ,HENRY EXHIBITIONS HE IS STILL KING Thierry Henry answered his critics across style as he combined with Robert Pires to haul Arsenal out of their slump. Henrys recent form took been termed into tura by Match of the Day pundit Alan Hansen only ,5.0
"Eagles QB Donovan McNabb is more relaxed, confident in pocket CLEVELAND -- On draft day 1999, the Browns picked Tim Couch with the No. 1 pick. The Eagles selected Donovan McNabb at No. 2. You hate to oversimplify things, but since then, Cleveland is 28-58, Philadelphia is 57-29.","Eagles QB Donovan McNabb is more relaxed, confident onto pocket CLEVELAND -- On draft day 1999, the Browns picked Tim Couch with the No. 1 pick. The Hawks elect Donovan McNabb at No. 2. You hate for oversimplify things, but since then, Cleveland is 28-58, Bryn is 57-29.",5.0
"NFL: New Orleans 28, St. Louis 25 (OT) A 31-yard field goal by John Carney in overtime Sunday gave the New Orleans Saints a 28-25 win over St. Louis. Carney kicked five field goals in the game, including a 38-yarder ","NFL: New Orleans 28, St. Louis 25 (OT) A 31-yard field goal by John Carney in ot Sunday gave the New Orleans Saints a 28-25 win over St. Louis. Carney kicked five campos goals in the jeu, comprise une 38-yarder ",5.0
Concur Wants to Track Your Travel Most companies need to keep tabs on travel   entertainment expenses. Concur thinks it has a better way.,Agree Wants to Pathway Your Travel Most companies need to keep tabs on travel   entertainment expenses. Concur feels it possesses una better way.,5.0
"Yukos Unit To Be Auctioned Off Next Month The heart of the Yukos oil empire will be auctioned by the government next month for what could be a bargain price to pay back a mounting multibillion-dollar tax bill  --  a dramatic finale to a relentless 18-month official probe that could destroy Russia's largest oil producer. A top Yukos manager slammed the plans as ""government-organized theft.""","Yukos Unit To Be Auctioned Deactivated Next Month The heart of the Yukos oil empire will be auctioned by the government next month for what could be a bargain costing to pay back a mounting multibillion-dollar tax bill  --  a dramatic finale to a relentless 18-month official probe that did destroy Russia's largest oil producer. A superior Yukos manager slammed the plans as ""government-organized rustling.""",5.0
Early ballots flood in across US Millions in the US have already cast their ballots under early vote programmes that could attract one in five.,Early bulletin avalanche in travers US Millions in the US have already cast their ballots under early vote programmes that could attract one among cinq.,5.0
"Explosives found in Russian crash MOSCOW Russia #39;s security service announced Friday that investigators had found traces of explosives in the wreckage of one of the two passenger airliners that crashed almost simultaneously on Tuesday, and declared its downing a terrorist act.","Remnants found in Soviets crash MOSCOW Russia #39;s security service announced Friday that investigators had found traces of explosive in the wreckage of one of the two passenger airliners that crashed almost simultaneously on Tuesday, and declared its downing una terrorist lois.",5.0
"Outsourcing issue flares up at chip conference A panel including two venture investors, a scholar, a laid-off software engineer and two chip industry CEOs debated the issue at the Hot Chips event sponsored by the IEEE.","Outsourcing issue torches up at flea conference A panel comprising two venture investors, a scholar, a laid-off software engineer and two chip industry CEOs debated nova issue at the Sexiest Chips event sponsored by the IEEE.",5.0
Ross Stores Profit Plummets 40 Percent (AP) AP - Discount retailer Ross Stores Inc. Wednesday said its profit fell about 40 percent in the latest quarter due to problems with a new computer system that limited the company's ability to respond to changes in customer demand.,Ross Warehouse Earns Plummets 40 Percent (AP) AP - Discount retailer Ross Stores Inc. Wednesday declared its incomes tumble about 40 percent in the latest quarter due to problems with a new computer system that limited the company's ability to respond to changes in customer demand.,5.0
"Starbucks to raise its prices beginning Oct. 6 SEATTLE - Starbucks will raise its beverage prices by 11 cents a cup on average starting Oct. 6, the world #39;s largest coffee-shop chain said Tuesday.","Starbucks to augment its prices launched Oct. 6 SEATTLE - Starbucks will raising its beverage prices by 11 cents a cup on average commences Oct. 6, the world #39;s largest coffee-shop chain stated Tuesday.",5.0
"Sadr Signals He Will Accept Peace Plan Shiite cleric Moqtada Sadr signaled that he would accept pleas to dissolve his militia and vacate the sacred Imam Ali shrine in Najaf, but asked for time for further negotiations.","Sadr Signals He Will Accept Peace Plan Shiite cleric Moqtada Sadr signaled that he would accept pleas to dissolve his militia and vacate the sacred Imam Ali shrine in Najaf, but demands per moment onto further bargaining.",5.0
Howard Stern Signs \$500 Million Deal with Sirius Sirius Satellite Radio announced a five-year deal with Howard Stern this morning that will bring the King of All Media to satellite radio in 2006.,Howard Transom Symptoms \$500 Million Deal with Sirius Sirius Satellite Radio heralded a five-year deal with Howard Stern this morning that will bring to King of All Mediums to satellite radio in 2006.,5.0
"Earthquake lets volcano blow off steam A minor 3.1 magnitude earthquake has split the lava dome in the crater of Mount St Helens, continuing a series of minor earthquakes that have rattled the site since October.","Earthquake enable outburst blow off steam A minor 3.1 magnitude earthquake has split the lava dome in the crater of Mount St Helens, unbroken a series of minor earthquakes that have buffeted the site since Janvier.",5.0
Illinois Notebook Illinois lost to Michigan by 11 points and committed just two penalties to the 10 charged against the Wolverines on Saturday. So why was Illinois head coach Ron Turner complaining about the officiating?,Illinois Notebook Illinois lost to Michigan by 11 points and committed just two penalties to the 10 charged against the Wolverines on Saturday. Too pourquoi became Illinois head coach Ron Turner bellyaching about nova officiating?,5.0
"Medarex #39;s Hodgkin #39;s treatment gets orphan status PRINCETON, NJ (Dow Jones/AP) _ Biopharmaceutical company Medarex Inc. said Wednesday its Hodgkin #39;s disease treatment was granted orphan drug designation by the Food and Drug Administration.","Medarex #39;s Hodgkin #39;s treatment gets orphaned status PRINCETON, NJ (Dow Jones/AP) _ Biopharmaceutical company Medarex Inc. asserted Thu its Hodgkin #39;s disease treatment was conceded foundling drug designation by the Food and Drug Administration.",5.0
"Split seasons a matter of making accommodation In a perfect racing world, Suffolk Downs management would like to see the return of a thoroughbred circuit between the East Boston oval and Rockingham Park in Salem, N.H., only on a smaller scale. However, current realities would appear to make that impossible.","Schism seasons a aspect of making accommodation In a perfect racing world, Suffolk Downs management would like to admire the return of a thoroughbred circuit between the East Boston oval and Rockingham Park in Salem, N.H., only on a smaller scale. Conversely, current realities should appear to make that impossible.",5.0
"South Korea Hunts Possible Infiltrators (AP) AP - South Korea's military tightened roadblocks and traffic checks north of Seoul after finding signs of possible infiltration by North Korean agents on Tuesday, officials said.","Syd Korea Hunter Potential Infiltrators (AP) AP - South Korea's military tightened roadblocks and traffic checks north of Seoul after finding signs of possible infiltration by North Korean officials on Tuesday, officials stated.",5.0
"China Hikes Interest Rates China on Thursday announced it would hike interest rates for most deposits and loans by 0.27 percentage points, the first rise in nine years.","Wa Increasing Interest Velocities China on Thursday announced it would augmentation interest rates for more deposits and loans by 0.27 percentage points, the first rise in nine years.",5.0
"BC has mountain to climb A year ago, Boston College coach Tom O'Brien described his team's 35-25 victory at Rutgers as  quot;the greatest gut-check I've ever been around, quot; after the Eagles rallied from a 22-13 halftime deficit to earn their all-important sixth win of the season, making them bowl eligible.","BC had mountain to soars una year ago, Boston College coach Tom O'Brien described his team's 35-25 victory at Rutgers as  quot;the greatest gut-check I've ever been around, quot; after the Eagles massed from a 22-13 halftime deficit to earn their all-important sixth win of the season, making them bowl admissible.",5.0
"Coke says earnings, sales growth to slow  ATLANTA -- Coca-Cola Co. warned investors to expect slower earnings and sales growth from the world's biggest soft drink company. But it said it is beefing up spending on marketing its core brands and on innovation as it tries to catch up with consumer's growing thirst for alternatives to soda.","Coke says earnings, sales heightened to lento  ATLANTA -- Coca-Cola Co. warned investors to expect slower earnings and sales rose from the world's biggest soft drink company. But it affirmed it is beefing up spending on marketing its core brands and sobre innovation as it tries to catch up with consumer's growing thirst for alternatives to soda.",5.0
"Protesters decry Gaza withdrawal  JERUSALEM -- Thousands of Israelis demonstrated across the country yesterday against Prime Minister Ariel Sharon's plan to withdraw from the Gaza Strip and a small part of the West Bank, hours after Sharon declared the pullout would begin in June.","Protesters decry Gaza withdrawal  JERUSALEM -- Thousands of Israelis demonstrated across the country yesterday against Prime Minister Ariel Sharon's plan to withdraw from the Gaza Strip and a small part of the West Bank, hours then Charon declared nova pullout would lancer for June.",5.0
"APEC Ministerial Meetings Set to Begin in Chile Ministers from 21 Asia-Pacific economies will begin meetings later Wednesday in Santiago, Chile, ahead of a summit of leaders from the region later this week.","APEC Departmental Meetings Set to Lancer at Pepper Ministers from 21 Asia-Pacific economies will begin meetings later Wednesday in Santiago, Chile, ahead of a summit of leaders from the region later this weeks.",5.0
"Sudan Rejects US-Sponsored Darfur Resolution Sudan on Wednesday rejected a US-sponsored UN Security Council draft resolution to punish it over a conflict in its western Darfur region, saying the measure was unfair and lacked balance.","Sudan Repudiated US-Sponsored Darfur Solved Sudan on Wednesday rejected a US-sponsored UN Security Council draft resolution to punish it over a conflict in its western Darfur region, saying the measure was undue and misses equilibrium.",5.0
Perverts face DNA order OTTAWA -- More convicted criminals will have to submit DNA samples to the national data bank - including those convicted of possession of child pornography - under newly proposed legislation tabled in the House of Commons yesterday.,Perverts face DNA ordering OTTAWA -- More convicted criminals volition ai for submit DNA samples to the national data bank - including those convicted of possession of child pornography - under newly proposed legislation tabled in the Dwellings of Commons yesterday.,5.0
