text,adv_text,minimal_k
"Productivity's Battleground (Forbes.com) Forbes.com - At its Twinsburg, Ohio plant (below), Rockwell uses its own Logix controllers to make the 2.5 million circuit boards per year that power them. On one line, sensors scan boards as they move along a conveyor; if a match is found, a controller inches the conveyor forward. The same controller tracks the temperature of an oven used to cure the glue between the electronics and the board, adjusting the speed of the oven's conveyor based on the reading. All the controllers are lashed to an enterprise-management program that spits out productivity readings every two hours and looks for bottlenecks. ...","Productivity's Battle (Forbes.com) Forbes.com - At its Twinsburg, Ohio plant (below), Rockwell uses its own Logix controllers to make the 2.5 million circuit boards per year that power them. On one line, sensors scan boards as they move along a conveyor; if a match is found, a controller inches the conveyor forward. The identical controller tracks the temperature of an oven used to cure the glue between the electronics and the board, adjusting the speed of the oven's conveyor based on the reading. Tous nova controllers are lashed for an enterprise-management program that spits out productivity readings every two hours and looks for bottlenecks. ...",5.0
Liverpool V Bayer Leverkusen Key Battles Liverpool seem to have been handed one of the easier last-16 draws after the group phase of the Champions League. But Rafael Benitez will be careful not to under-estimate the experienced ,Liverpool V Bayer Leverkusen Key Struggling Liverpool seem to have been handed one of the easier last-16 draws after the group phase of the Champions League. But Rafael Benitez volition be careful neither to under-estimate nova underwent ,5.0
"BMW Keeps 2004 Forecast German premium carmaker BMW reported a lower-than-expected 7.6 percent rise in third-quarter pretax profit, but reaffirmed its forecast for record revenues, earnings and car sales in 2004.","BMW Keeps 2004 Predicting German premium carmaker BMW reported a lower-than-expected 7.6 percent rise in third-quarter pretax profit, yet reaffirmed its forecast for docket revenues, earnings and vehicular sales onto 2004.",5.0
"Cowboys win their stadium game vote The Dallas Cowboys scored a major victory in Arlington Tuesday as a referendum to build them a stadium passed convincingly. With at least two-thirds of Arlington #39;s ballots counted Tuesday night, 54 percent ","Cowboys win their stadium game vote The Dallas Cowboys scored a major victory in Arlington Tuesday as a referendum to build them a stadium passed convincingly. Avec at minus two-thirds of Arlington #39;s ballots accounted Friday night, 54 percentage ",5.0
"Karzai #39;s amnesty offer to Taliban All facts,challenges and problems considered, and there are many (from the security issue to the mobilization of a brand new free nations with very little if at all infrastructure and functioning civil society to ethnic, economical and political factor ","Karzai #39;s amnesty delivers to Taliban All facts,challenges and problems considered, and there are many (from to security issue to the mobilization of una marks new free nations with very little if at all infrastructure and functioning civil society for ethnic, economical and political factor ",5.0
"Weis Introduced at Notre Dame  SOUTH BEND, Ind. (Sports Network) - Charlie Weis was  introduced as the new head football coach at Notre Dame on  Monday and said he intends to bring the program back to  national prominence.","Weis Tabled at Notre Dame  SOUTH BEND, Ind. (Sports Network) - Charlie Weis was  introduced as the new head football coach at Notre Dame on  Monday and told he intends to bring the agendas backwards aux  national prominence.",5.0
"Tiger needs focus It #39;s doubtful that Elin Nordegren, retired swimsuit model and nanny, ever aspired to the title  quot;Most Powerful Person in Golf.","Tiger needs focus It #39;s uncertain that Elin Nordegren, pension swimsuit model and nanny, permanently aspired to the title  quot;Most Powerful Persona onto Golf.",5.0
"Saban might be ready to scratch that NFL itch BATON ROUGE -- If you had asked me a few weeks ago about Nick Saban and his coaching future, I would have told you he #39;d be back coaching at LSU the next two seasons.","Saban might be ready to scratch that NFL itch BATON ROUGE -- Unless you had urged me a few weeks ago about Nicky Saban and her coaching impending, I would have told you he #39;d be back coaching at LSU the next two seasons.",5.0
"Middleware moves into open source JBoss Application Server 4.0, middleware recently certified for J2EE, is ready for enterprise production deployment, according to JBoss.","Middleware moves en open backgrounds JBoss Application Server 4.0, middleware recently certified for J2EE, is readies toward enterprise production deployment, according of JBoss.",5.0
"Yanks #39; Rivera Intends to Be Back for ALCS PANAMA CITY, Panama -- A grieving Mariano Rivera returned to Panama after two family members were electrocuted in his pool, but the star reliever intends to be in New York when the Yankees open their playoff series with the Boston Red Sox.","Yanks #39; Rivera Intends to Be Backwards for ALCS PANAMA CITY, Panama -- A grieving Mariano Rivera comeback de Panama after two family members were electrocuted in his pool, but nova star reliever intends to fi in New York when the Yankees open their playoff series with the Boston Red Sox.",5.0
"Jobless Claims Up on Impact of Charley WASHINGTON - The number of new people signing up for jobless benefits rose last week, reflecting the impact of hurricane Charley, which recently tore through Florida.    The Labor Department reported Thursday that new applications for unemployment insurance increased by a seasonally adjusted 10,000 to 343,000 for the week ending Aug...","Jobless Claims Arriba on Impact of Charlie WASHINGTON - The number of new people signing up for jobless benefits rose last week, reflecting the impact of hurricane Charley, which recently tore through Florida.    The Labor Department reported Thursday that new applications for unemployment insurance increased by a seasonally adjusted 10,000 to 343,000 for the zhou discontinue February...",5.0
"These robots are positively bestial NAHANT, Mass. - Joseph Ayers was crouched over a laptop computer in a cool cinder-block shed barely big enough to house a riding lawn mower, watching a black lobster through a rectangular acrylic window.","These robots are favourably bestial NAHANT, Masse. - Joseph Ayers was crouched over a laptop computer in a cool cinder-block shed barely big enough to house a riding lawn mower, watching una nigger lobster across a rectangular acrylic window.",5.0
Oracle may drop PeopleSoft lawsuit Oracle says it will nix the claim unless PeopleSoft shareholders agree to sell at least half their holdings by on Nov. 19.,Oracle maybe tumbling PeopleSoft lawsuit Oracle affirms it will nix the claim unless PeopleSoft shareholders agree to sell at less half their holdings by on Juni. 19.,5.0
"Mozilla Gains Five Points, IE Slips Five Web analytics provider OneStat.com has announced that Mozilla #39;s browsers have earned a total global usage share of 7.35, forcing Microsoft #39;s flagship Internet Explorer (IE) to drop below 90.","Mozilla Earns Five Points, IE Slip Five Web analytics provider OneStat.com has announced that Mozilla #39;s browsers have earned a total global usage share of 7.35, prompting Microsoft #39;s flagship Internet Explorer (CI) to drop beneath 90.",5.0
"Lycos pulls the plug on anti-spam screensaver Lycos Europe has yanked its  quot;Make Love, Not Spam quot; anti-spam screensaver from its site, leaving only a cryptic message of  quot;Stay Tuned quot; in its place.","Lycos pulls to plug sobre anti-spam screensaver Lycos Europe has yanked its  quot;Make Love, Not Spam quot; anti-spam screensaver from its site, leaving unattached a cryptic message to  quot;Stay Tuned quot; for its place.",5.0
Social Security a Priority for White House (AP) AP - THE PROBLEM: Social Security faces a  #36;3.7 trillion shortfall over 75 years.,Social Secure a Priority under White House (AP) AP - THE PROBLEM: Social Seguro facing a  #36;3.7 trillion inadequacy over 75 years.,5.0
"U.S. Brokers Cease-fire in Western Afghanistan  KABUL (Reuters) - The United States has brokered a  cease-fire between a renegade Afghan militia leader and the  embattled governor of the western province of Herat,  Washington's envoy to Kabul said Tuesday.","U.S. Courtiers Cease-fire in Western Afghanistan  KABUL (Reuters) - The United States has brokered a  cease-fire between a renegade Afghan militia leader and the  embattled governor of the western boycott of Herat,  Washington's emissary to Kabul stated Monday.",5.0
"Stem cell advocates to request \$1B Emboldened by the success of a stem cell ballot initiative in California last week, two scientists who have long pushed for an ambitious research center for the biotechnology ","Stalk cell advocates de enquired \$1B Emboldened by the success of a stem cell ballot initiative in California last week, two scientists who have long pushed pour an ambitious research center into the biotechnology ",5.0
"Multiplayer Games Coming to Cell Phones (AP) AP - As millions buy increasingly powerful cell phones, many companies are racing to develop video games to take advantage of the newfound portability.","Multiplayer Games Coming of Cell Phones (AP) AP - As millions procured increasingly powerful cell phones, many undertakings are racing to devising video games to take parti of the newfound portability.",5.0
"Delta seeks deal to keep pilots NEW YORK -- Delta Air Lines Inc. managers and pilots will meet again today, and likely negotiate through the weekend, to find a way to keep the airline staffed with pilots, as many opt for early retirement.","Delta sought processing to keep pilots NEW YORK -- Delta Air Lines Inc. managers and pilots will meet again today, and likely negotiate through the weekend, to find a way to sustain the airline staffed with pilots, as many opt under precocious retirement.",5.0
"Saudi Police Shoot Dead Suspect Militant in Jeddah (Reuters) Reuters - Saudi security forces shot dead a\suspected militant on Saturday in a clash in the Red Sea port\city of Jeddah, police and witnesses said.","Saudi Police Shoot Dead Suspects Militant for Jeddah (Reuters) Reuters - Saudi security army shot dead a\suspected militant on Saturday in a clash in the Red Sea port\city of Jeddah, police and witness told.",5.0
"Iraq Oil Exports Unchanged After Basra Attack (Reuters) Reuters - Iraq's oil exports are still flowing at\one million barrels per day through southern terminals despite\an attack on the South Oil Company headquarters on Thursday, an\oil official at the company said.","Iraq Oil Exports Unchanged After Basra Attack (Reuters) Reuters - Iraq's oil importer are still flowing at\one million barrels per day through southern terminals whilst\an attack on the South Oil Company headquarters on Thursday, an\oil functionaries at nova company declared.",5.0
"Aftershocks continue to rattle quake-stricken Niigata Strong aftershocks continued to rattle Niigata Prefecture on Monday after a series of devastating quakes on Saturday night left 25 people dead and more than 2,500 others injured, the Meteorological Agency and police said.","Aftershocks continue de rattle quake-stricken Niigata Strong aftershocks sustained to rattle Niigata Prefecture on Monday after a series of devastating quakes on Saturday night left 25 people dead and more than 2,500 others aggrieved, the Meteorological Agency and constabulary stated.",5.0
"McNair Day to Day With Bruised Sternum (AP) AP - Steve McNair is hurting, frustrated and just wants to finally get healthy. For now, the Tennessee Titans will only say he's day to day.","jie Day to Day With Bruised Sternum (AP) AP - Steve McNair is hurting, frustrated and just wants to finally get healthy. For presently, the Tennessee Titans will unattached say he's dias to days.",5.0
"Schroeder meeting with Gaddafi announced after deal German Chancellor Gerhard Schroeder will travel to Tripoli on October 15 for a meeting with Libyan leader Muammar Gaddafi, government sources said on Saturday.","Schroeder meeting with Gaddafi announced upon handling German Chancellor Gerhard Schroeder volition travel to Tripoli on October 15 to a meeting with Libyan leader Muammar Gaddafi, government sources declared on Saturday.",5.0
"Mars Once Ripe for Life, Rovers Discover Water once covered thousands of square miles of Mars, creating an ancient environment that hints at the possibility that life might be present there yet today, scientists reported.","Mar After Ripe under Life, Rovers Detection Water once covered thousands of square miles of Mars, creating an ancient environment that hints at the possibility that life might be present there yet today, scientific reported.",5.0
"Update 1: Bond Prices Are Mostly Lower at Midday The price of the Treasury #39;s 10-year note was down 1/16 point, or 63 cents per \$1,000 in face value, while its yield rose to 4.10 percent from 4.09 percent late Monday.","Retrofitted 1: Bond Prices Are Essentially Lesser per Midday The price of the Treasury #39;s 10-year note was down 1/16 point, or 63 cents per \$1,000 in face value, while its yield augmentation to 4.10 percent from 4.09 percent late Monday.",5.0
"AL notables Oakland won the season series against Seattle for the first time since 2000. Angels' Vladimir Guerrero matched a career high for hits with his fifth four-hit game this season and 15th in his career. It was the second two-homer game this week for Guerrero, who has 38 this year and is hitting .338 with a team-record 123 runs and 124 ...","AL notables Oakland won the season series against Seattle for the first time since 2000. Angels' Vladimir Guerrero matched a career high for hits with his fifth four-hit jeu this season and 15th in his career. It was nova secs two-homer ballgame this weekly for Guerrero, who has 38 this year and is hitting .338 with a team-record 123 runs and 124 ...",5.0
"Despite Discord, Biffle and Busch to remain teammates Mears wins Busch pole at Lowe #39;s. Casey Mears won the second Busch series pole of his career, earning the top starting position in qualifying for the SpongeBob 300.","Despite Discord, Biffle and Busch to remain teammates Mears wins Busch pole at Lowe #39;s. Casey Mears triumphed to second Busch series pole of his career, earning the top starting position at qualifying under the squarepants 300.",5.0
Risk-all tactics in aim for glory MELBOURNE golfer David McKenzie today will try to duplicate the aggressive approach which netted a sensational eight-under 64 at Huntingdale yesterday.,Risk-all tactics for intending under luster MELBOURNE golfer David McKenzie today will try to duplicate the aggressive methodology which netted a sensational eight-under 64 at Huntingdale yesterday.,5.0
 #39;Experts ignored risks of drug #39; A widely prescribed arthritis drug withdrawn on safety grounds in September should have been taken off the market several years earlier., #39;Experts neglect risks of drugs #39; A widely prescribed arthritis drug withdrawn on safety grounds in September ought have been took seaward the market several years earlier.,5.0
"Microsoft: Linux may mean price cuts, fewer sales SEC filing shows just how much open source is worrying the software giant.","Microsoft: Linux may mean price clippings, fewer sales SEC filing showings just how much open source exists troubling the software mammoth.",5.0
"China to cut deficit, curb government investment in 2005: official BEIJING : The Chinese government will try to cut its huge deficit next year and curb investment financed from public coffers, state media said, quoting Vice Finance Minister Lou Jiwei.","Wah to cut deficit, curb government investment in 2005: official BEIJING : The Chinese government will endeavour to cut its mammoth deficit next year and curb investment financed from public coffers, state media avowed, quoting Vice Hacienda Minister Lou Jiwei.",5.0
"Shell, Sinopec in China Retail Venture Royal Dutch/Shell Group (RD.AS: Quote, Profile, Research) (SHEL.L: Quote, Profile, Research) said it would jointly operate 180 gas stations in China by the end of 2004, the ","Misprint, Sinopec in China Retail Venture Royal Dutch/Shell Group (RD.AS: Quote, Profile, Research) (SHEL.L: Quote, Profile, Research) said it ought collectively operate 180 gas stations in China by the discontinue of 2004, nova ",5.0
"Salton's Quarterly Loss Widens  NEW YORK (Reuters) - Salton Inc. &lt;A HREF=""http://www.investor.reuters.com/FullQuote.aspx?ticker=SFP.N target=/stocks/quickinfo/fullquote""&gt;SFP.N&lt;/A&gt;, a maker of  household appliances, on Wednesday reported wider quarterly  losses as hefty restructuring charges more than offset higher  revenue.","Salton's Quarterly Loss Augmentation  NEW YORK (Reuters) - Salton Inc. &lt;A HREF=""http://www.investor.reuters.com/FullQuote.aspx?ticker=SFP.N target=/stocks/quickinfo/fullquote""&gt;SFP.N&lieutenant;/A&gt;, a maker of  household appliances, on Wednesday reported akbar quarterly  losses as hefty restructuring charges more than eccentricity higher  profit.",5.0
"Saved at the death JUST like ESPN Star Sports v StarHub, Manchester United left it until the very last moment to appease their followers last night. As thousands of Singapore fans waited right up to programme time for the live ","Saved at the death JUST like ESPN Star Sports v StarHub, Norwich United left it until the very last moment to appease their followers last night. As thousands of Singapore fans waiting right up to programme time pour nova lived ",5.0
"1980 Mount St. Helens Eruption Remembered COLDWATER RIDGE, Wash. - The rumblings, the steady earthquakes, the throat-clearing steam blasts all seem so eerily familiar...","1980 Mount St. Helens Eruption Remembered COLDWATER RIDGE, Wash. - The rumblings, the steady earthquakes, the throat-clearing steamship blasts tous transpires thus eerily colloquial...",5.0
"12 Nepalese Reportedly Executed in Iraq DUBAI, United Arab Emirates - A Web site linked to an Iraqi militant group showed a video of what was purported to be the killing of 12 Nepalese workers by militants who had kidnapped them.    The Nepalese Foreign Ministry said it could not confirm the report of the hostages' deaths...","12 Nepalese Reportedly Executed in Iraq DUBAI, United Arab Emirates - A Web site linked to an Iraqi militant group showed a video of what was purported to be the killing of 12 Nepalese workers by militants who had kidnapped them.    The Nepalese Extraterrestrial Ministry affirmed it could nope confirm the report of nova hostages' dying...",5.0
Regulators focus on phone choices for small businesses WASHINGTON The Associated Press reports some details are coming out today about proposed federal rules for regional phone companies.,Regulators focus on phone choices for small businesses WASHINGTON The Associated Press reports some details are coming out presently roundabout proposed federal rules pour regional telephoned enterprising.,5.0
"Images of Beslan hostages add to Russia's agony (AFP) AFP - Horrifying pictures of masked gunmen stepping through pools of blood as they wire a gym crammed with hundreds of terrified children, teachers and parents in the opening hours of the Beslan hostage tragedy were aired by Russian television.","Pictures of Beslan hostages inserting to Russia's agony (AFP) AFP - Horrifying pictures of masked gunmen stepping through pools of blood as they wire a gym crammed with hundreds of terrified children, teachers and parents onto the opening hours of the Beslan hostage tragic were dispensed by Russian television.",5.0
"VoIP: A Shot in Telecom's Arm (washingtonpost.com) washingtonpost.com - SBC Communications is the latest Baby Bell to jump headlong into the world of Internet telephony, a move aimed at boosting its offerings in an increasingly competitive broadband marketplace and at catching up with upstart 'Net phone players like Vonage that have seen a surge in business as consumers look for cheaper calling plans.","VoIP: una Shot in Telecom's Arm (washingtonpost.com) washingtonpost.com - SBC Communications is de latest Toddler Ringtone to jump headlong into the worid of Internet telephony, a move aimed at boosting its offerings in an increasingly competitive broadband marketplace and at catching up with upstart 'Net phone players like Vonage that have seen a surge in business as consumers look for cheaper calling plans.",5.0
"EU, Iran to hold talks - Teheran torn in nuclear dispute TEHERAN - Iranian officials are preparing to hold talks with Germany, Britain and France on over its controversial nuclear programme with Teheran torn between willingness to compromise and the urge to maintain national pride.","UE, Iran to hold talks - Teheran torn in nuclear dispute TEHERAN - Iranian functionaries are bracing to hold negotiations with Germany, Britain and France on over its controversial nuclear programme with Teheran torn between willingness to compromise and the urged to maintain national pride.",5.0
"No. 1 Deacons Take On Providence Wednesday Night Television: ESPN2. Dave O #39;Brien (play-by-play), Len Elmore (color analysis) and Stacey Dales-Schuman (sidelines) call the action.","Nothing. 1 Deacons Take For Providence Wednesday Night Television: ESPN2. Dave O #39;Brien (play-by-play), Len Elmore (color analysis) and Stacey Dales-Schuman (sidelines) appealed nova activities.",5.0
"Opposition slams Pakistan PM vote ISLAMABAD, Pakistan -- The appointment of a close ally of Pakistani President Pervez Musharraf as the country #39;s new prime minister has been criticized as showing the  quot;rule of oppression.","Opposition criticizing Pakistan PM vote ISLAMABAD, Pakistan -- The designation of a close ally of Pakistani President Pervez Musharraf as the country #39;s new prime minister has been rebuked as depicting the  quot;rule of despotism.",5.0
"Cost of Insuring Workers' Health Increases 11.2 It was the fourth consecutive year of double-digit increases in health insurance premiums, which has resulted in a decline in the number of insured workers.","Cost of Insuring Workers' Health Increases 11.2 It was the fourth consecutive year of double-digit increases in health insurance bonuses, which has resulted across una decline onto nova number of insured workers.",5.0
"Pope Returns  quot;rare icon quot; to Russia #39;s Orthodox Church MOSCOW, RUSSIA (ANS/BosNewsLife) -- A Vatican cardinal has handed a rare icon back to the Russian Orthodox Church in Moscow as a personal gift from Pope John Paul II, the British Broadcasting Corporation (BBC) reported Saturday, August 28.","Pope Reverted  quot;rare icon quot; to Russia #39;s Orthodox Church MOSCOW, RUSSIA (ANS/BosNewsLife) -- A Vatican cardinal has handed a rare icon back de the Russian Orthodox Church in Moscow as a personal gift from Pope John Paul II, the Britannica Broadcasting Corporation (BBC) informed Saturday, Augusto 28.",5.0
"With Affection's Has Kick With Affection comes from off the pace to pass tiring leaders and gallop to an easy victory Saturday in the \$50,000 Japan Racing Association Handicap on the turf at Pimlico.","With Affection's Has Kicking With Affection comes from off the pace to pass tiring leaders and gallop to an easy victory Saturday in the \$50,000 Japans Race Associations Handicap for the turf at Pimlico.",5.0
"Tramford Intl Up; Sells Security Products To Lenovo Group NEW YORK (Dow Jones)--Shares of Tramford International Ltd. (TRFDF) rose nearly 50 Wednesday, on news that a customer agreed to acquire the personal-computer business of International Business Machines Corp.","Tramford Intl Arriba; Sells Security Products To Lenovo Group NEW YORK (Dow Jones)--Shares of Tramford International Ltd. (TRFDF) rose hardly 50 Wednesday, on news that una customer consented to purchases the personal-computer business of International Business Machines Corp.",5.0
"Philips Posts Best Quarterly Results in Four Years Often pigeonholed as just a seller of televisions and DVD players, Royal Philips Electronics said Tuesday that its third-quarter profit surged despite ","Philippe Posts Nicest Quarterly Results in Four Ages Often pigeonholed as just a seller of televisions and DVD players, Royal Phillippe Electronics said Tuesday that its third-quarter profit surged whereas ",5.0
"Bush phones Paisley in power sharing bid US President George W Bush has telephoned the Rev Ian Paisley in a bid to help revive power sharing in Northern Ireland. Rev Paisley, 78, said he had  quot;a long and very useful conversation quot; with Mr Bush as Protestant ","Bush phones Paisley in power sharing bid US President George W Bush has telephoned the Rev Ian Paisley in a bid to help revive power sharing in Northern Ireland. Rev Beasley, 78, avowed he had  quot;a long and very useful dialogue quot; with Olli Busch as Protestant ",5.0
First Look: Nokia Preminet  The Next Generation In Content &lt;b&gt;...&lt;/b&gt; Entering a market where there are already several well established players Nokias Preminet open service model solution is being heralded as the next generation of content delivery systems for wireless devices.,First Look: Nokia Preminet  Du Next Generation In Content &lt;b&gt;...&lt;/b&gt; Penetrating a marketplace whenever there are already several well established players Nokias Preminet open service model solution is being heralded as nova next generation of content delivery systems for wireless devices.,5.0
